"","varcode","nro","wave","russian","english"
"1","idind",1,"i21","ЕДИНЫЙ ИДЕНТИФИКАЦИОННЫЙ НОМЕР ИНДИВИДА ДЛЯ ВОЛН 5 И ПОСЛЕДУЮЩИХ","Unique identification number for a wave 5 INDIVIDUAL AND FOLLOW"
"2","QREDID_I",2,"i21","НОМЕР ИНДИВИДА В 21-Й ВОЛНЕ - СПЛОШНАЯ НУМЕРАЦИЯ","NUMBER individual in the 21-th wave - numbered consecutively"
"3","QID_I",3,"i21","НОМЕР ИНДИВИДА В 21-Й ВОЛНЕ - ИДЕНТИФИКАЦИОННЫЙ","NUMBER individual in the 21-th wave - IDENTIFICATION"
"4","qid_h",4,"i21","ИДЕНТИФИКАЦИОННАЯ ПЕРЕМЕННАЯ 21-го РАУНДА","Identification variable 21 Round"
"5","pid_i",5,"i21","НОМЕР ИНДИВИДА В 20-Й ВОЛНЕ - ИДЕНТИФИКАЦИОННЫЙ","NUMBER individual in the 20-th wave - IDENTIFICATION"
"6","pid_h",6,"i21","ИДЕНТИФИКАЦИОННАЯ ПЕРЕМЕННАЯ 20-го РАУНДА","Identification variable 20 Round"
"7","oid_i",7,"i21","НОМЕР ИНДИВИДА В 19-ОЙ ВОЛНЕ - ИДЕНТИФИКАЦИОННЫЙ","NUMBER individual in the 19-second wave - IDENTIFICATION"
"8","oid_h",8,"i21","ИДЕНТИФИКАЦИОННАЯ ПЕРЕМЕННАЯ 19-го РАУНДА","Identification variable 19 Round"
"9","nid_i",9,"i21","НОМЕР ИНДИВИДА В 18-ОЙ ВОЛНЕ - ИДЕНТИФИКАЦИОННЫЙ","NUMBER individual in the 18-second wave - IDENTIFICATION"
"10","nid_h",10,"i21","ИДЕНТИФИКАЦИОННАЯ ПЕРЕМЕННАЯ 18-го РАУНДА","Identification variables 18th-round"
"11","mid_i",11,"i21","НОМЕР ИНДИВИДА В 17-ОЙ ВОЛНЕ - ИДЕНТИФИКАЦИОННЫЙ","NUMBER individual in the 17-second wave - IDENTIFICATION"
"12","mid_h",12,"i21","ИДЕНТИФИКАЦИОННАЯ ПЕРЕМЕННАЯ 17-го РАУНДА","Identification variable 17 Round"
"13","lid_i",13,"i21","НОМЕР ИНДИВИДА В 16-Й ВОЛНЕ - ИДЕНТИФИКАЦИОННЫЙ","NUMBER individual in the 16-th wave - IDENTIFICATION"
"14","lid_h",14,"i21","ИДЕНТИФИКАЦИОННАЯ ПЕРЕМЕННАЯ 16-го РАУНДА","Identification variable 16 Round"
"15","kid_i",15,"i21","НОМЕР ИНДИВИДА В 15-Й ВОЛНЕ - ИДЕНТИФИКАЦИОННЫЙ","NUMBER individual in the 15-th wave - IDENTIFICATION"
"16","kid_h",16,"i21","ИДЕНТИФИКАЦИОННАЯ ПЕРЕМЕННАЯ 15-го РАУНДА","Identification variable 15 Round"
"17","jid_i",17,"i21","НОМЕР ИНДИВИДА В 14-Й ВОЛНЕ - ИДЕНТИФИКАЦИОННЫЙ","NUMBER individual in the 14-th wave - IDENTIFICATION"
"18","jid_h",18,"i21","ИДЕНТИФИКАЦИОННАЯ ПЕРЕМЕННАЯ 14-го РАУНДА","Identification variable 14 Round"
"19","iid_i",19,"i21","НОМЕР ИНДИВИДА В 13-Й ВОЛНЕ - ИДЕНТИФИКАЦИОННЫЙ","NUMBER individual in the 13-th wave - IDENTIFICATION"
"20","iid_h",20,"i21","ИДЕНТИФИКАЦИОННАЯ ПЕРЕМЕННАЯ 13-го РАУНДА","Identification variables 13th ROUND"
"21","hid_i",21,"i21","НОМЕР ИНДИВИДА В 12-Й ВОЛНЕ - ИДЕНТИФИКАЦИОННЫЙ","NUMBER individual in the 12-th wave - IDENTIFICATION"
"22","hid_h",22,"i21","ИДЕНТИФИКАЦИОННАЯ ПЕРЕМЕННАЯ 12-го РАУНДА","Identification variables of the 12th round"
"23","gid_i",23,"i21","НОМЕР ИНДИВИДА В 11-Й ВОЛНЕ - ИДЕНТИФИКАЦИОННЫЙ","NUMBER individual in the 11-th wave - IDENTIFICATION"
"24","gid_h",24,"i21","ИДЕНТИФИКАЦИОННАЯ ПЕРЕМЕННАЯ 1-го РАУНДА","Identification variables Round 1"
"25","fid_i",25,"i21","НОМЕР ИНДИВИДА В 10-Й ВОЛНЕ - ИДЕНТИФИКАЦИОННЫЙ","NUMBER individual in the 10-th wave - IDENTIFICATION"
"26","fid_h",26,"i21","ИДЕНТИФИКАЦИОННАЯ ПЕРЕМЕННАЯ 10-го РАУНДА","Identification variables Round 10"
"27","eid_i",27,"i21","НОМЕР ИНДИВИДА В 9-Й ВОЛНЕ - ИДЕНТИФИКАЦИОННЫЙ","NUMBER of individuals in the 9 th wave - IDENTIFICATION"
"28","eid_h",28,"i21","ИДЕНТИФИКАЦИОННАЯ ПЕРЕМЕННАЯ 9-го РАУНДА","Identification variables 9th round"
"29","did_i",29,"i21","НОМЕР ИНДИВИДА В 8-Й ВОЛНЕ - ИДЕНТИФИКАЦИОННЫЙ","NUMBER of individuals in the 8-th wave - IDENTIFICATION"
"30","did_h",30,"i21","ИДЕНТИФИКАЦИОННАЯ ПЕРЕМЕННАЯ 8-го РАУНДА","Identification variables Round 8"
"31","cid_i",31,"i21","НОМЕР ИНДИВИДА В 7-Й ВОЛНЕ - ИДЕНТИФИКАЦИОННЫЙ","NUMBER of individuals in the 7-th wave - IDENTIFICATION"
"32","cid_h",32,"i21","ИДЕНТИФИКАЦИОННАЯ ПЕРЕМЕННАЯ 7-го РАУНДА","Identification variables Round 7"
"33","bid_i",33,"i21","НОМЕР ИНДИВИДА В 6-Й ВОЛНЕ - ИДЕНТИФИКАЦИОННЫЙ","NUMBER of individuals in the 6-th wave - IDENTIFICATION"
"34","bid_h",34,"i21","ИДЕНТИФИКАЦИОННАЯ ПЕРЕМЕННАЯ 6-го РАУНДА","Identification variables 6th round"
"35","aid_i",35,"i21","НОМЕР ИНДИВИДА В 5-Й ВОЛНЕ - ИДЕНТИФИКАЦИОННЫЙ","NUMBER of individuals in the 5th wave - IDENTIFICATION"
"36","aid_h",36,"i21","ИДЕНТИФИКАЦИОННАЯ ПЕРЕМЕННАЯ 5-го РАУНДА","Identification variables Round 5"
"37","q_origsm",37,"i21","АДРЕС ПЕРВОНАЧАЛЬНОЙ ВЫБОРКИ? - в 21-й волне","ADDRESS original sample? - In the 21 th wave"
"38","q_inwgt",38,"i21","SAMPLE WEIGHT OF INDIVIDUAL IN ROUND 21","SAMPLE WEIGHT OF INDIVIDUAL IN ROUND 21"
"39","region",39,"i21","Регион","region"
"40","psu",40,"i21","ПЕРВИЧНАЯ ЕДИНИЦА ОТБОРА","PRIMARY UNIT SELECTION"
"41","site",41,"i21","НОМЕР НАСЕЛЕННОГО ПУНКТА","NUMBER settlements"
"42","ssu",42,"i21","Вторичная единица отбора","The secondary sampling units"
"43","status",43,"i21","ТИП НАСЕЛЕННОГО ПУНКТА","Type of settlement"
"44","popul",44,"i21","ЧИСЛЕННОСТЬ НАСЕЛЕНИЯ","POPULATION"
"45","iomover21",45,"i21","1 IF PERSON MOVED OUT OF SURVEY SAMPLE IN ROUND 21","1 IF PERSON MOVED OUT OF SURVEY SAMPLE IN ROUND 21"
"46","q_int_y",46,"i21","Год опроса","year of survey"
"47","q_born_m",47,"i21","МЕСЯЦ РОЖДЕНИЯ РЕБЕНКА - 21 ВОЛНА","MONTH Childbirth - 21 WAVE"
"48","q_adult",48,"i21","Есть взрослый вопросник 21 волны?","There are 21 waves adult questionnaire?"
"49","q_child",49,"i21","Есть детский вопросник 21 волны?","There is a children's questionnaire 21 waves?"
"50","q_marst",50,"i21","СЕМЕЙНОЕ ПОЛОЖЕНИЕ - 21 ВОЛНА","MARITAL STATUS - 21 WAVE"
"51","q_occup",51,"i21","ПРОФЕССИОНАЛЬНАЯ ГРУППА - 21 ВОЛНА","Professional groups - 21 WAVE"
"52","q_educ",52,"i21","ОБРАЗОВАНИЕ (ПОДРОБНО): старше 14 лет","EDUCATION (details): over 14 years"
"53","q_diplom",53,"i21","ЗАКОНЧЕННОЕ ОБРАЗОВАНИЕ (ГРУППА)","Completed education (GROUP)"
"54","y_birth",54,"i21","ГОД РОЖДЕНИЯ - НАИБОЛЕЕ ВЕРОЯТНЫЙ ПО ДАННЫМ ВОЛН 5-21","Year of birth - most likely ACCORDING TO WAVE 5-21"
"55","q_i_year",55,"i21","Год сбора данных по миграции","Vintage data migration"
"56","qh3a",56,"i21","НОМЕР СЕМЬИ","FAMILY ROOM"
"57","qh4",57,"i21","Номер члена семьи","Number of family members"
"58","qh4.1",58,"i21","Респондент ранее участвовал(а) в исследовании?","Respondent has previously taken part (a) in the study?"
"59","qh5",59,"i21","Пол респондента","Sex of the respondent"
"60","qh6",60,"i21","Год рождения респондента 21 ВОЛНА (=qj69.9c)","Year of birth of respondent 21 WAVE (= qj69.9c)"
"61","qh7.1",61,"i21","Дата проведения интервью: число","Date of interview: the number of"
"62","qh7.2",62,"i21","Дата проведения интервью: месяц","Date of interview: Month"
"63","qh8a",63,"i21","Интервью продолжалось: часов и минут (часов)","Interview continued: hours and minutes (hours)"
"64","qh8b",64,"i21","Интервью продолжалось: часов и минут (минут)","Interview continued: hours and minutes (minutes)"
"65","qi1",65,"i21","Вы родились в другом населенном пункте или в том; где живете сейчас?","You were born in another location or in; where do you live now?"
"66","qi2",66,"i21","В какой республике бывшего СССР Вы родились?","In some former Soviet republics were you born?"
"67","qi3",67,"i21","Вы родились в городе; поселке городского типа или в селе; деревне; кишлаке; ауле?","You were born in the city; a small town or village; village; village; aul?"
"68","qi3.1",68,"i21","Вы жили в другом населенном пункте - не в том; где Вы родились; более чем 6 месяцев подряд после того; как Вам исполнилось 14 лет; включая учебу; службу в армии и прочее?","You have lived in another village - not that; where you were born; more than 6 consecutive months thereafter; as you are at least 14 years of age; including studies; served in the army and so on?"
"69","qi4",69,"i21","Кем Вы себя считаете по национальности?","Who do you think you are by nationality?"
"70","qi7",70,"i21","С какого года Вы живете в данном населенном пункте?","Since when do you live in this village?"
"71","qi8",71,"i21","С какого года Вы постоянно живете в Российской Федерации?","When did you always live in the Russian Federation?"
"72","qj1",72,"i21","Ваше основное занятие в настоящее время?","Your main occupation now?"
"73","qj1.1.1",73,"i21","Насколько Вы удовлетворены или не удовлетворены Вашей работой в целом?","Are you satisfied or dissatisfied with your work in general?"
"74","qj1.1.2",74,"i21","Насколько Вы удовлетворены или не удовлетворены условиями Вашего труда?","Are you satisfied or not satisfied with the terms of your work?"
"75","qj1.1.3",75,"i21","Насколько Вы удовлетворены или не удовлетворены оплатой Вашего труда?","Are you satisfied or dissatisfied with the payment of your work?"
"76","qj1.1.4",76,"i21","Насколько Вы удовлетворены или не удовлетворены возможностями для Вашего профессионального роста?","Are you satisfied or dissatisfied with opportunities for your professional growth?"
"77","qj2code",77,"i21","Код профессии по ISCO88 основной работы","Code profession ISCO88 basic work"
"78","qj4.1",78,"i21","В какой отрасли Вы работаете на этой работе?","In what industry you work in this job?"
"79","qj5a",79,"i21","С какого года Вы работаете на этом предприятии? Если Вы увольнялись и снова возвращались на то же предприятие; назовите дату последнего возвращения (ГОД)","When did you work for this company? If you leave and come back again to the same company; name the date of the last return (year)"
"80","qj5b",80,"i21","С какого месяца Вы работаете на этом предприятии? Если Вы увольнялись и снова возвращались на то же предприятие; назовите дату последнего возвращения (МЕСЯЦ)","From what month you work at this business? If you leave and come back again to the same company; name the date of the last return (months)"
"81","qj5.2",81,"i21","Как Вы нашли эту Вашу основную работу?","How did you find this your main job?"
"82","qj6",82,"i21","У Вас есть подчиненные на этой работе?","Do you have a slave in this job?"
"83","qj6.0",83,"i21","Сколько у Вас подчиненных? Пожалуйста; посчитайте всех Ваших подчиненных; а не только тех; кто находится в Вашем непосредственном подчинении","How you subordinates? Please; count all your subordinates; not just those; who is your direct submission"
"84","qj6.1a",84,"i21","Сколько в среднем продолжается Ваш обычный рабочий день на этой работе: часов и минут? (ЧАСОВ)","What is the average continuing your normal working day on the job: hours and minutes? (Hours)"
"85","qj6.1b",85,"i21","Сколько в среднем продолжается Ваш обычный рабочий день на этой работе: часов и минут? (МИНУТ)","What is the average continuing your normal working day on the job: hours and minutes? (MIN)"
"86","qj6.2",86,"i21","Сколько часов в среднем продолжается Ваша обычная рабочая неделя?","How many hours on average lasts your usual working week?"
"87","qj7",87,"i21","Вы работали по основному месту работы в течение последних 30 дней?","You worked on the main job in the last 30 days?"
"88","qj7.1",88,"i21","Сколько всего рабочих дней было у Вас за последние 30 дней?","How many days did you have in the last 30 days?"
"89","qj8",89,"i21","Сколько часов Вы фактически отработали по основному месту работы в течение последних 30 дней?","How many hours you actually worked on the main job in the last 30 days?"
"90","qj8.1",90,"i21","Скажите; пожалуйста; Вы работали по основной работе дома в течение последних 30 дней?","tell me; please; You worked on the main job at home in the last 30 days?"
"91","qj8.2",91,"i21","Сколько часов Вы фактически занимались этой работой дома в течение последних 30 дней?","How many hours did you actually doing this work at home in the last 30 days?"
"92","qj8.3",92,"i21","Скажите; пожалуйста; Вы учитывали эти часы; когда называли общую продолжительность рабочего времени за последние 30 дней?","tell me; please; You take into account those hours; called when the total duration of working time in the last 30 days?"
"93","qj9",93,"i21","По основному месту работы в течение последних 30 дней Вы получили какую-нибудь сумму денег в качестве зарплаты; премии; дотаций; пособий; доходов; прибыли?","The main job in the last 30 days you have received any money as salary; Prize; subsidies; benefits; income; profits?"
"94","qj10",94,"i21","Сколько денег в течение последних 30 дней Вы получили по основному месту работы после вычета налогов и отчислений? Если все или часть денег Вы получили в иностранной валюте; переведите все в рубли и назовите общую сумму","How much money in the last 30 days you will get the main job after taxes and deductions? If all or part of the money you received in foreign currency; turn all into rubles and name totaling"
"95","qj10.1",95,"i21","Как Вы думаете; какой процент этих денег был проведен официально; то есть с них были уплачены налоги?","What do you think; what percentage of the money was held officially; that is, they had paid taxes?"
"96","qj10.2",96,"i21","Если Вы получали премию по основному месту работы в течение последних 30 дней; то сколько рублей Вы получили?","If you have received the award in the main job in the last 30 days; how many rubles you get?"
"97","qj11",97,"i21","На этой работе Вы работаете на предприятии; в организации? Мы имеем в виду любую организацию; в которой работает более одного человека; независимо от того; частная она или государственная","In this job you work in the enterprise; in the organization? We mean any organization; which employs more than one person; regardless; it private or public"
"98","qj11.1",98,"i21","Вы оформлены на этой работе официально; то есть по трудовой книжке; трудовому соглашению; контракту?","You feature on this work officially; that is, the workbook; employment agreement; contract?"
"99","qj11.2",99,"i21","Почему Вы не оформлены на этой работе официально?","Why do not you feature on this work officially?"
"100","qj13",100,"i21","Сколько человек работает на Вашем предприятии? Если не знаете точно; скажите примерно","How many people work at your company? If you do not know exactly; tell me about"
"101","qj13.2",101,"i21","За последние 12 месяцев какова была Ваша среднемесячная зарплата на этом предприятии после вычета налогов - независимо от того; платят Вам ее вовремя или нет?","Over the past 12 months, what was your average monthly salary at the plant after taxes - no matter; You pay it on time or not?"
"102","qj14",102,"i21","В настоящее время Ваше предприятие осталось должно Вам какие-то деньги; которые по разным причинам не выплатило вовремя?","Currently, your company owes you some money; who for various reasons are not paid on time?"
"103","qj15",103,"i21","Сколько всего денег Вам не доплатили?","How much money you do not pay extra?"
"104","qj16",104,"i21","За сколько месяцев предприятие не доплатило Вам эти деньги?","For many months, the company does not pay you the money?"
"105","qj18.2",105,"i21","В течение последних 12 месяцев Вам уменьшали зарплату или сокращали часы работы не по Вашему желанию?","In the last 12 months you have reduced wages or reduced work hours not according to your wishes?"
"106","qj19",106,"i21","В течение последних 12 месяцев Вас отправляла администрация в вынужденный неоплачиваемый отпуск?","In the last 12 months you sent the administration a forced unpaid leave?"
"107","qj21a",107,"i21","В течение последних 12 месяцев Вы были в оплачиваемом отпуске?","During the past 12 months, have you been in paid vacation?"
"108","qj21b",108,"i21","Сколько всего календарных дней продолжался или продолжается этот отпуск?","How many days continued or resumed this holiday?"
"109","qj21.3",109,"i21","Является ли производство; на котором Вы работаете; вредным или опасным; т.е. дающим Вам право на досрочное назначение трудовой пенсии; на дополнительные выплаты или льготы?","Is production; where you work; harmful or dangerous; ie giving you the right to early appointment of labor pension; additional payments or benefits?"
"110","qj23",110,"i21","Является государство владельцем или совладельцем Вашего предприятия; организации?","The State is the owner or co-owner of your company; the organization?"
"111","qj24",111,"i21","Являются владельцами или совладельцами Вашего предприятия; организации иностранные фирмы или иностранные частные лица?","Is the owner or co-owners of your company; organization of foreign companies or foreign individuals?"
"112","qj25",112,"i21","Являются владельцами или совладельцами Вашего предприятия; организации какие-то российские частные лица; коллектив предприятия или российские частные фирмы?","Is the owner or co-owners of your company; organization of any Russian private person; collective enterprises, or Russian private firms?"
"113","qj26",113,"i21","А Вы лично являетесь владельцем или совладельцем предприятия; на котором Вы работаете?","Do you personally own or co-owner of the company; where do you work?"
"114","qj29",114,"i21","Как Вы считаете; на этой работе Вы занимаетесь предпринимательской деятельностью?","What do you think; this work you engage in entrepreneurial activity?"
"115","qj308",115,"i21","Пожалуйста; скажите; предприятие или организация; в которой Вы работаете на основной работе; было создано:","Please; tell; company or organization; you work in the main job; was created"
"116","qj309",116,"i21","Форма собственности предприятия или организации; в которой Вы работаете на основной работе; с тех пор:","Ownership of the enterprise or organization; you work in the main job; since then:"
"117","qj29.c1",117,"i21","В какой степени Вы доверяете руководству Вашего предприятия; организации?","To what extent do you trust the leadership of your company; the organization?"
"118","qj29.c2",118,"i21","В какой степени Вы доверяете людям; с которыми Вы вместе работаете; Вашим коллегам?","To what extent do you trust the people; with whom you work together; Your colleagues?"
"119","qj22",119,"i21","Представьте себе не очень приятную картину: предприятие; где Вы работаете; по каким-то причинам закроется; и все работники уволены. Насколько Вы уверены в том; что сможете найти работу не хуже той; на которой работаете сейчас?","Imagine not very pleasant picture: the enterprise; where you work; for whatever reasons, will close; and all employees laid off. How confident are you that; that will be able to find a job is not worse than that; on which work now?"
"120","qj29.0",120,"i21","На этой работе Вы занимаетесь...?","In this job you do ...?"
"121","qj31",121,"i21","Насколько Вас беспокоит то; что Вы можете потерять работу?","As far as you are concerned; you could lose your job?"
"122","qj29.1",122,"i21","Вы сменили место работы или профессию по сравнению с ноябрем 2011 года; или все осталось по-прежнему?","You changed jobs or profession compared to November 2011; or all remained the same?"
"123","qj29.1s",123,"i21","ДРУГОЕ к вопросу j29.1","To each question j29.1"
"124","qj29.2.1",124,"i21","После ноября 2011 года Вы продвинулись по службе; получили более высокую должность?","Since November 2011 you moved to the service; received a higher position?"
"125","qj29.2.2",125,"i21","После ноября 2011 года Вы перешли работать в другое структурное подразделение - отдел; цех и т.п.?","Since November 2011 you went to work in other business units - Department; shop, etc.?"
"126","qj29.2.3",126,"i21","После ноября 2011 года Вы перешли на более низкую должность?","Since November 2011 you moved to a lower position?"
"127","qj32",127,"i21","У Вас есть еще какая-нибудь работа?","Do you still have any work?"
